[
  {
    "id": "animal_sheep_vi_3_5",
    "topic": "animals",
    "ageGroup": "3-5",
    "title": "Con cừu",
    "riddle": "Con gì mặc áo len dày,\nKhông sợ lạnh gió heo may.\nSống trên đồng cỏ xanh mát,\nKêu be be rất vui tai?",
    "answer": "Con cừu",
    "fact": "Cừu có bộ lông dày. Lông cừu có thể dùng để làm len may áo ấm.",
    "vocabulary": [
      "cừu",
      "len",
      "đồng cỏ",
      "ấm áp"
    ],
    "quiz": {
      "question": "Con nào cho ta lông để làm len?",
      "options": [
        "Con mèo",
        "Con cừu",
        "Con cá"
      ],
      "correctAnswer": "Con cừu"
    },
    "coloringPrompt": "Một chú cừu tròn trịa, dễ thương đứng trên đồng cỏ, nét đơn giản cho trẻ em tô màu.",
    "imagePrompt": "Cute fluffy sheep standing in a green meadow, warm children's book illustration style.",
    "shortVideoScript": "Đố bé biết: Con gì mặc áo len dày, kêu be be trên đồng cỏ? 3...2...1... Đáp án là con cừu!",
    "worksheetInstruction": "Khoanh tròn con cừu và tô màu bộ lông của cừu.",
    "parentGuide": "Hỏi bé: Áo len giúp mình cảm thấy thế nào khi trời lạnh?",
    "safetyNotes": [],
    "difficulty": 1,
    "status": "reviewed"
  },
  {
    "id": "animal_elephant_vi_3_5",
    "topic": "animals",
    "ageGroup": "3-5",
    "title": "Con voi",
    "riddle": "Con gì tai lớn như quạt,\nCái vòi dài thật là hay.\nBước đi chậm rãi trong rừng,\nThân to khỏe bé đoán ngay?",
    "answer": "Con voi",
    "fact": "Voi là loài vật rất to lớn. Voi dùng vòi để uống nước, lấy thức ăn và chào nhau.",
    "vocabulary": [
      "voi",
      "vòi",
      "tai",
      "rừng"
    ],
    "quiz": {
      "question": "Voi dùng bộ phận nào để lấy thức ăn?",
      "options": [
        "Cái vòi",
        "Cái cánh",
        "Cái vây"
      ],
      "correctAnswer": "Cái vòi"
    },
    "coloringPrompt": "Một chú voi con vui vẻ có tai to và vòi dài, nét rõ ràng cho bé tô màu.",
    "imagePrompt": "Adorable baby elephant with big ears and long trunk, friendly children's illustration.",
    "shortVideoScript": "Con gì có tai to như quạt và chiếc vòi dài? Đáp án là con voi!",
    "worksheetInstruction": "Nối chiếc vòi với con voi.",
    "parentGuide": "Hỏi bé: Vòi voi có thể làm được những việc gì?",
    "safetyNotes": [],
    "difficulty": 1,
    "status": "reviewed"
  },
  {
    "id": "animal_cat_vi_3_5",
    "topic": "animals",
    "ageGroup": "3-5",
    "title": "Con mèo",
    "riddle": "Con gì mắt sáng ban đêm,\nRón rén đi nhẹ bên thềm.\nThích ăn cá, kêu meo meo,\nNằm cuộn tròn ngủ rất êm?",
    "answer": "Con mèo",
    "fact": "Mèo thường đi rất nhẹ. Mèo có ria giúp cảm nhận không gian xung quanh.",
    "vocabulary": [
      "mèo",
      "ria",
      "meo meo",
      "ban đêm"
    ],
    "quiz": {
      "question": "Mèo thường kêu như thế nào?",
      "options": [
        "Gâu gâu",
        "Meo meo",
        "Ụt ịt"
      ],
      "correctAnswer": "Meo meo"
    },
    "coloringPrompt": "Một chú mèo con đang nằm cuộn tròn ngủ, nét đơn giản dễ tô màu.",
    "imagePrompt": "Cute kitten curled up sleeping, soft children's book style.",
    "shortVideoScript": "Con gì thích ăn cá, kêu meo meo? Đúng rồi, đó là con mèo!",
    "worksheetInstruction": "Tô màu chú mèo và vẽ thêm cái đĩa cá.",
    "parentGuide": "Hỏi bé: Nhà mình đã từng thấy mèo ở đâu?",
    "safetyNotes": [
      "Nhắc trẻ không tự ý kéo đuôi hoặc trêu chọc vật nuôi."
    ],
    "difficulty": 1,
    "status": "reviewed"
  },
  {
    "id": "animal_dog_vi_3_5",
    "topic": "animals",
    "ageGroup": "3-5",
    "title": "Con chó",
    "riddle": "Con gì giữ cửa rất ngoan,\nThấy người quen vẫy đuôi mừng.\nKêu gâu gâu vang trước ngõ,\nBạn thân của bé phải không?",
    "answer": "Con chó",
    "fact": "Chó là vật nuôi thân thiết với con người. Nhiều chú chó có thể trông nhà và chơi cùng trẻ em.",
    "vocabulary": [
      "chó",
      "gâu gâu",
      "vẫy đuôi",
      "trông nhà"
    ],
    "quiz": {
      "question": "Chó thường kêu như thế nào?",
      "options": [
        "Meo meo",
        "Gâu gâu",
        "Quạc quạc"
      ],
      "correctAnswer": "Gâu gâu"
    },
    "coloringPrompt": "Một chú chó con vui vẻ đang vẫy đuôi, nét to rõ cho bé tô màu.",
    "imagePrompt": "Happy puppy wagging tail, cute preschool educational illustration.",
    "shortVideoScript": "Con gì kêu gâu gâu và hay vẫy đuôi? Đáp án là con chó!",
    "worksheetInstruction": "Khoanh tròn chú chó đang vẫy đuôi.",
    "parentGuide": "Dạy bé xin phép người lớn trước khi chạm vào chó lạ.",
    "safetyNotes": [
      "Không đến gần chó lạ khi không có người lớn."
    ],
    "difficulty": 1,
    "status": "reviewed"
  },
  {
    "id": "animal_duck_vi_3_5",
    "topic": "animals",
    "ageGroup": "3-5",
    "title": "Con vịt",
    "riddle": "Con gì chân có màng xinh,\nBơi trên ao nhỏ lung linh.\nMiệng kêu cạp cạp vui quá,\nLạch bạch đi giữa sân đình?",
    "answer": "Con vịt",
    "fact": "Vịt có chân màng giúp bơi dưới nước dễ hơn.",
    "vocabulary": [
      "vịt",
      "ao",
      "chân màng",
      "cạp cạp"
    ],
    "quiz": {
      "question": "Vịt bơi ở đâu?",
      "options": [
        "Trên cây",
        "Dưới ao",
        "Trong hang"
      ],
      "correctAnswer": "Dưới ao"
    },
    "coloringPrompt": "Một chú vịt con bơi trên ao, có vài bông hoa súng, nét đơn giản.",
    "imagePrompt": "Cute yellow duckling swimming in a pond, simple cheerful children's illustration.",
    "shortVideoScript": "Con gì bơi dưới ao, kêu cạp cạp? Đó là con vịt!",
    "worksheetInstruction": "Nối con vịt với cái ao.",
    "parentGuide": "Hỏi bé: Những con vật nào biết bơi?",
    "safetyNotes": [
      "Nhắc trẻ không tự ra gần ao hồ khi không có người lớn."
    ],
    "difficulty": 1,
    "status": "reviewed"
  },
  {
    "id": "animal_cow_vi_3_5",
    "topic": "animals",
    "ageGroup": "3-5",
    "title": "Con bò",
    "riddle": "Con gì ăn cỏ ngoài đồng,\nKêu ò ò thật vang không?\nCho ta dòng sữa trắng,\nBé đoán được hay không?",
    "answer": "Con bò",
    "fact": "Bò cho sữa. Sữa giúp cơ thể có thêm dinh dưỡng.",
    "vocabulary": [
      "bò",
      "sữa",
      "đồng cỏ",
      "ò ò"
    ],
    "quiz": {
      "question": "Con bò có đặc điểm gì nổi bật?",
      "options": [
        "sữa",
        "đồng cỏ",
        "ò ò"
      ],
      "correctAnswer": "sữa"
    },
    "coloringPrompt": "Một con bò dễ thương, nét đơn giản, rõ ràng cho trẻ 3-5 tuổi tô màu.",
    "imagePrompt": "Cute con bò for preschool educational content, simple children's book illustration.",
    "shortVideoScript": "Đố bé biết: Con gì ăn cỏ ngoài đồng, ... Đáp án là Con bò!",
    "worksheetInstruction": "Tô màu con bò và khoanh tròn đặc điểm đúng.",
    "parentGuide": "Hỏi bé: Con bò thường sống ở đâu hoặc có âm thanh như thế nào?",
    "safetyNotes": [],
    "difficulty": 1,
    "status": "reviewed"
  },
  {
    "id": "animal_chicken_vi_3_5",
    "topic": "animals",
    "ageGroup": "3-5",
    "title": "Con gà",
    "riddle": "Con gì sáng gáy ò ó,\nGọi mặt trời dậy thật to.\nCó mào đỏ trên đầu nhỏ,\nBé đoán xem đó là con gì?",
    "answer": "Con gà",
    "fact": "Gà trống thường gáy vào buổi sáng.",
    "vocabulary": [
      "gà",
      "mào",
      "ò ó o",
      "buổi sáng"
    ],
    "quiz": {
      "question": "Con gà có đặc điểm gì nổi bật?",
      "options": [
        "mào",
        "ò ó o",
        "buổi sáng"
      ],
      "correctAnswer": "mào"
    },
    "coloringPrompt": "Một con gà dễ thương, nét đơn giản, rõ ràng cho trẻ 3-5 tuổi tô màu.",
    "imagePrompt": "Cute con gà for preschool educational content, simple children's book illustration.",
    "shortVideoScript": "Đố bé biết: Con gì sáng gáy ò ó, ... Đáp án là Con gà!",
    "worksheetInstruction": "Tô màu con gà và khoanh tròn đặc điểm đúng.",
    "parentGuide": "Hỏi bé: Con gà thường sống ở đâu hoặc có âm thanh như thế nào?",
    "safetyNotes": [],
    "difficulty": 1,
    "status": "reviewed"
  },
  {
    "id": "animal_rabbit_vi_3_5",
    "topic": "animals",
    "ageGroup": "3-5",
    "title": "Con thỏ",
    "riddle": "Con gì tai dài thật xinh,\nNhảy nhanh trên bãi cỏ xanh.\nThích ăn cà rốt màu cam,\nBé gọi tên thật nhanh?",
    "answer": "Con thỏ",
    "fact": "Thỏ có đôi tai dài và thường nhảy rất nhanh.",
    "vocabulary": [
      "thỏ",
      "tai dài",
      "cà rốt",
      "nhảy"
    ],
    "quiz": {
      "question": "Con thỏ có đặc điểm gì nổi bật?",
      "options": [
        "tai dài",
        "cà rốt",
        "nhảy"
      ],
      "correctAnswer": "tai dài"
    },
    "coloringPrompt": "Một con thỏ dễ thương, nét đơn giản, rõ ràng cho trẻ 3-5 tuổi tô màu.",
    "imagePrompt": "Cute con thỏ for preschool educational content, simple children's book illustration.",
    "shortVideoScript": "Đố bé biết: Con gì tai dài thật xinh, ... Đáp án là Con thỏ!",
    "worksheetInstruction": "Tô màu con thỏ và khoanh tròn đặc điểm đúng.",
    "parentGuide": "Hỏi bé: Con thỏ thường sống ở đâu hoặc có âm thanh như thế nào?",
    "safetyNotes": [],
    "difficulty": 1,
    "status": "reviewed"
  },
  {
    "id": "animal_frog_vi_3_5",
    "topic": "animals",
    "ageGroup": "3-5",
    "title": "Con ếch",
    "riddle": "Con gì ngồi cạnh bờ ao,\nKêu ộp ộp dưới mưa rào.\nNhảy một cái thật cao,\nBé đoán tên thế nào?",
    "answer": "Con ếch",
    "fact": "Ếch sống gần nơi ẩm ướt và có thể nhảy xa.",
    "vocabulary": [
      "ếch",
      "bờ ao",
      "ộp ộp",
      "nhảy"
    ],
    "quiz": {
      "question": "Con ếch có đặc điểm gì nổi bật?",
      "options": [
        "bờ ao",
        "ộp ộp",
        "nhảy"
      ],
      "correctAnswer": "bờ ao"
    },
    "coloringPrompt": "Một con ếch dễ thương, nét đơn giản, rõ ràng cho trẻ 3-5 tuổi tô màu.",
    "imagePrompt": "Cute con ếch for preschool educational content, simple children's book illustration.",
    "shortVideoScript": "Đố bé biết: Con gì ngồi cạnh bờ ao, ... Đáp án là Con ếch!",
    "worksheetInstruction": "Tô màu con ếch và khoanh tròn đặc điểm đúng.",